{
  "schema_version": "1.0",
  "study": {
    "study_id": "EXAMPLE-INCOMPLETE-001",
    "version": "1.0",
    "research_question": "What can one verified fictional Example District order show?",
    "governing_circuit": "Example Circuit",
    "district": "Example District",
    "decisionmakers": ["Judge Incomplete Example"],
    "date_range": {
      "start": "2024-01-01",
      "end": "2024-12-31"
    },
    "included_motion_types": ["Rule 59(e) alter or amend"],
    "case_categories": ["fictional civil action"],
    "excluded_categories": [],
    "databases_searched": ["Example District synthetic docket index"],
    "search_queries": ["fictional incomplete Rule 59(e) Example District"],
    "search_dates": ["2025-01-15"],
    "deduplication_method": "Case number and motion identifier",
    "known_unavailable_sources": [
      "Synthetic motion",
      "Synthetic proposed pleading"
    ],
    "denominator_definition": "One located fictional Rule 59(e) motion in Example District with incomplete motion-side materials"
  },
  "denominator": {
    "defined_universe": "One located fictional Rule 59(e) motion in Example District with incomplete motion-side materials",
    "sampling_method": "attempted-census",
    "candidate_count": 1,
    "coded_pair_count": 1,
    "research_question_complete_count": 0,
    "unresolved_relevant_missingness": 2,
    "completeness_status": "incomplete",
    "limits": ["Two motion-side documents remain unavailable"]
  },
  "decision_records": [
    {
      "record_id": "EXAMPLE-INCOMPLETE-RECORD-001",
      "motion_id": "EXAMPLE-INCOMPLETE-MOTION-001",
      "related_stage_ids": [],
      "case_name": "Example Gamma v. Example Agency",
      "case_number": "EX-24-0099",
      "court": "Example District",
      "assigned_judge": "Judge Incomplete Example",
      "reasoning_author": "Judge Incomplete Example",
      "recommendation_author": null,
      "adopting_judge": null,
      "decision_type": "independently-reasoned-final-decision",
      "posture": {
        "challenged_disposition": "Fictional dismissal judgment",
        "judgment_status": "Final fictional judgment entered",
        "rule_subsection": "59(e)",
        "motion_type": "Alter or amend judgment",
        "case_category": "fictional civil action",
        "representation_status": "unknown"
      },
      "ground_children": [
        {
          "ground_id": "EXAMPLE-INCOMPLETE-GROUND-001",
          "asserted_ground": "unknown from unavailable motion",
          "court_treatment": "The fictional order stated that relief was denied",
          "ground_result": "not sustained",
          "supporting_pinpoint": "Synthetic order page 2"
        }
      ],
      "requested_relief": ["Relief described only in the fictional order"],
      "proposed_material": {
        "status": "unknown",
        "description": "The synthetic proposed material is unavailable"
      },
      "independent_reasoning": "independent",
      "disposition": {
        "code": "deny",
        "stated_reasons": ["manifest-error-not-shown"],
        "outcome_changing_reason": "The fictional order found no manifest error"
      },
      "sources": [
        {
          "source_id": "EXAMPLE-INCOMPLETE-SOURCE-001",
          "source_type": "synthetic final order",
          "identity": "Example District synthetic docket document 30",
          "checked_date": "2025-01-15"
        }
      ],
      "missing_documents": [
        {
          "gap_id": "EXAMPLE-GAP-001",
          "document_type": "motion",
          "description": "The synthetic Rule 59 motion is unavailable"
        },
        {
          "gap_id": "EXAMPLE-GAP-002",
          "document_type": "proposed pleading",
          "description": "The synthetic proposed pleading is unavailable"
        }
      ],
      "appellate_history": {
        "appeal_taken": false,
        "review_standard": "Not applicable",
        "result": "No appeal located in the fictional record",
        "checked_through": "2025-01-15"
      },
      "retrieval_status": "ruling-complete",
      "coding_confidence": "medium"
    }
  ],
  "retrieval_gaps": [
    {
      "gap_id": "EXAMPLE-GAP-001",
      "record_id": "EXAMPLE-INCOMPLETE-RECORD-001",
      "candidate_id": "EXAMPLE-INCOMPLETE-CANDIDATE-001",
      "document_type": "motion",
      "status": "unavailable",
      "retrieval_attempts": [
        "Reviewed the Example District synthetic docket index"
      ],
      "limit": "Motion-design analysis is not permitted"
    },
    {
      "gap_id": "EXAMPLE-GAP-002",
      "record_id": "EXAMPLE-INCOMPLETE-RECORD-001",
      "candidate_id": "EXAMPLE-INCOMPLETE-CANDIDATE-001",
      "document_type": "proposed pleading",
      "status": "unavailable",
      "retrieval_attempts": [
        "Reviewed the Example District synthetic docket index"
      ],
      "limit": "Proposed-material analysis is not permitted"
    }
  ],
  "transfer_cards": [
    {
      "card_id": "EXAMPLE-INCOMPLETE-CARD-001",
      "proposition": "One fictional Example District order denied relief on its stated ground.",
      "universe": "One verified fictional order from an incomplete Example District search",
      "numerator": 1,
      "denominator": 1,
      "date_range": "2024-01-01 through 2024-12-31",
      "source_row_ids": ["EXAMPLE-INCOMPLETE-RECORD-001"],
      "evidence_level": "example",
      "missingness": "The motion and proposed pleading are unavailable and the candidate universe is incomplete",
      "disconfirming_row_ids": [],
      "permitted_use": "Use only as a bounded fictional example of the stated disposition",
      "prohibited_inference": "Do not infer frequency, success rate, drafting quality, causation, prediction, or strategy",
      "checked_through": "2025-01-15",
      "actual_source_identity": "Example District synthetic docket document 30",
      "source_checked_date": "2025-01-15",
      "metric_type": "descriptive"
    }
  ]
}
