{
  "schema_version": "1.0",
  "study": {
    "study_id": "EXAMPLE-COMPLETE-001",
    "version": "1.0",
    "research_question": "How did fictional Example District decisions describe Rule 59 grounds?",
    "governing_circuit": "Example Circuit",
    "district": "Example District",
    "decisionmakers": [
      "Judge Final Example",
      "Magistrate Example",
      "Judge Independent Example"
    ],
    "date_range": {
      "start": "2024-01-01",
      "end": "2024-12-31"
    },
    "included_motion_types": ["Rule 59(e) alter or amend"],
    "case_categories": ["fictional civil action"],
    "excluded_categories": ["Rule 59(a) motions"],
    "databases_searched": ["Example District synthetic docket index"],
    "search_queries": ["fictional Rule 59(e) Example District"],
    "search_dates": ["2025-01-15"],
    "deduplication_method": "Case number and motion identifier",
    "known_unavailable_sources": [],
    "denominator_definition": "All fictional Rule 59(e) motions in the Example District synthetic index during 2024"
  },
  "denominator": {
    "defined_universe": "All fictional Rule 59(e) motions in the Example District synthetic index during 2024",
    "sampling_method": "attempted-census",
    "candidate_count": 2,
    "coded_pair_count": 2,
    "research_question_complete_count": 2,
    "unresolved_relevant_missingness": 0,
    "completeness_status": "complete",
    "limits": ["Fictional validation material only"]
  },
  "decision_records": [
    {
      "record_id": "EXAMPLE-REC-001",
      "motion_id": "EXAMPLE-MOTION-001",
      "related_stage_ids": ["EXAMPLE-ADOPT-001"],
      "case_name": "Example Alpha v. Example City",
      "case_number": "EX-24-0001",
      "court": "Example District",
      "assigned_judge": "Judge Final Example",
      "reasoning_author": "Magistrate Example",
      "recommendation_author": "Magistrate Example",
      "adopting_judge": null,
      "decision_type": "recommendation",
      "posture": {
        "challenged_disposition": "Fictional dismissal judgment",
        "judgment_status": "Final fictional judgment entered",
        "rule_subsection": "59(e)",
        "motion_type": "Alter or amend judgment",
        "case_category": "fictional civil action",
        "representation_status": "represented"
      },
      "ground_children": [
        {
          "ground_id": "EXAMPLE-GROUND-001",
          "asserted_ground": "manifest-error-not-shown",
          "court_treatment": "Fictional recommendation rejected the asserted error",
          "ground_result": "not sustained",
          "supporting_pinpoint": "Synthetic recommendation page 4"
        }
      ],
      "requested_relief": ["Vacate the fictional dismissal judgment"],
      "proposed_material": {
        "status": "complete-attached",
        "description": "Synthetic proposed amended pleading"
      },
      "independent_reasoning": "recommendation-only",
      "disposition": {
        "code": "deny",
        "stated_reasons": ["manifest-error-not-shown"],
        "outcome_changing_reason": "The fictional record did not show manifest error"
      },
      "sources": [
        {
          "source_id": "EXAMPLE-SOURCE-REC-001",
          "source_type": "synthetic recommendation",
          "identity": "Example District synthetic docket document 10",
          "checked_date": "2025-01-15"
        }
      ],
      "missing_documents": [],
      "appellate_history": {
        "appeal_taken": false,
        "review_standard": "Not applicable",
        "result": "No appeal in the fictional record",
        "checked_through": "2025-01-15"
      },
      "retrieval_status": "complete-pair",
      "coding_confidence": "high"
    },
    {
      "record_id": "EXAMPLE-ADOPT-001",
      "motion_id": "EXAMPLE-MOTION-001",
      "related_stage_ids": ["EXAMPLE-REC-001"],
      "case_name": "Example Alpha v. Example City",
      "case_number": "EX-24-0001",
      "court": "Example District",
      "assigned_judge": "Judge Final Example",
      "reasoning_author": null,
      "recommendation_author": "Magistrate Example",
      "adopting_judge": "Judge Final Example",
      "decision_type": "adoption-only-order",
      "posture": {
        "challenged_disposition": "Fictional dismissal judgment",
        "judgment_status": "Final fictional judgment entered",
        "rule_subsection": "59(e)",
        "motion_type": "Alter or amend judgment",
        "case_category": "fictional civil action",
        "representation_status": "represented"
      },
      "ground_children": [
        {
          "ground_id": "EXAMPLE-GROUND-002",
          "asserted_ground": "manifest-error-not-shown",
          "court_treatment": "Adopted the fictional recommendation without additional reasoning",
          "ground_result": "not sustained",
          "supporting_pinpoint": "Synthetic adoption order page 1"
        }
      ],
      "requested_relief": ["Vacate the fictional dismissal judgment"],
      "proposed_material": {
        "status": "complete-attached",
        "description": "Synthetic proposed amended pleading"
      },
      "independent_reasoning": "adopts-without-additional-reasoning",
      "disposition": {
        "code": "deny",
        "stated_reasons": ["other-stated-reason"],
        "outcome_changing_reason": "No additional reasoning was stated"
      },
      "sources": [
        {
          "source_id": "EXAMPLE-SOURCE-ADOPT-001",
          "source_type": "synthetic adoption order",
          "identity": "Example District synthetic docket document 11",
          "checked_date": "2025-01-15"
        }
      ],
      "missing_documents": [],
      "appellate_history": {
        "appeal_taken": false,
        "review_standard": "Not applicable",
        "result": "No appeal in the fictional record",
        "checked_through": "2025-01-15"
      },
      "retrieval_status": "complete-pair",
      "coding_confidence": "high"
    },
    {
      "record_id": "EXAMPLE-FINAL-001",
      "motion_id": "EXAMPLE-MOTION-002",
      "related_stage_ids": [],
      "case_name": "Example Beta v. Example County",
      "case_number": "EX-24-0002",
      "court": "Example District",
      "assigned_judge": "Judge Independent Example",
      "reasoning_author": "Judge Independent Example",
      "recommendation_author": null,
      "adopting_judge": null,
      "decision_type": "independently-reasoned-final-decision",
      "posture": {
        "challenged_disposition": "Fictional summary judgment",
        "judgment_status": "Final fictional judgment entered",
        "rule_subsection": "59(e)",
        "motion_type": "Alter or amend judgment",
        "case_category": "fictional civil action",
        "representation_status": "represented"
      },
      "ground_children": [
        {
          "ground_id": "EXAMPLE-GROUND-003",
          "asserted_ground": "record-or-inference-error",
          "court_treatment": "Fictional final order corrected one record statement",
          "ground_result": "partially sustained",
          "supporting_pinpoint": "Synthetic final order page 6"
        }
      ],
      "requested_relief": ["Amend the fictional judgment"],
      "proposed_material": {
        "status": "not-applicable",
        "description": "No proposed pleading was relevant to the fictional motion"
      },
      "independent_reasoning": "independent",
      "disposition": {
        "code": "correction-without-relief",
        "stated_reasons": [
          "record-or-inference-error",
          "correction-does-not-change-result"
        ],
        "outcome_changing_reason": "The fictional correction did not alter judgment"
      },
      "sources": [
        {
          "source_id": "EXAMPLE-SOURCE-FINAL-001",
          "source_type": "synthetic final order",
          "identity": "Example District synthetic docket document 20",
          "checked_date": "2025-01-15"
        }
      ],
      "missing_documents": [],
      "appellate_history": {
        "appeal_taken": true,
        "review_standard": "Fictional abuse-of-discretion review",
        "result": "Fictional affirmance",
        "checked_through": "2025-01-15"
      },
      "retrieval_status": "complete-pair",
      "coding_confidence": "high"
    }
  ],
  "retrieval_gaps": [],
  "transfer_cards": [
    {
      "card_id": "EXAMPLE-CARD-001",
      "proposition": "The two fictional motion pairs received different forms of disposition.",
      "universe": "Two complete fictional Rule 59(e) motion pairs in Example District during 2024",
      "numerator": 2,
      "denominator": 2,
      "date_range": "2024-01-01 through 2024-12-31",
      "source_row_ids": ["EXAMPLE-REC-001", "EXAMPLE-FINAL-001"],
      "evidence_level": "tendency",
      "missingness": "No unresolved relevant missingness in the fictional universe",
      "disconfirming_row_ids": [],
      "permitted_use": "Illustrate the neutral transfer format with fictional complete data",
      "prohibited_inference": "Do not infer causation, prediction, or litigation strategy",
      "checked_through": "2025-01-15",
      "actual_source_identity": "Example District synthetic docket documents 10, 11, and 20",
      "source_checked_date": "2025-01-15",
      "metric_type": "descriptive"
    }
  ]
}
